URL,True Intent,True Entities,audios,Transcript,Pred Intent,Pred Entities
https://classlm.blob.core.windows.net/backend-logs/X2SvdC6NYsAVEse5RBVAWK.wav,p2p_transfer,['amount_of_money-100'],../data/en/npci_pipeline_benchmark/audio/X2SvdC6NYsAVEse5RBVAWK.wav,transfer one hundred rupees,p2p_transfer,['amount_of_money-100']
https://classlm.blob.core.windows.net/backend-logs/VdGYy6a9pXwfQTCZAwFBPF.wav,unknown,['mobile_number-9441362937'],../data/en/npci_pipeline_benchmark/audio/VdGYy6a9pXwfQTCZAwFBPF.wav,nine four four one three six two nine three seven,mobile_recharge_prepaid,['mobile_number-9441362937']
https://classlm.blob.core.windows.net/backend-logs/RGCoHMbgLYzYj5wTHa3eB9.wav,mobile_recharge_prepaid,[],../data/en/npci_pipeline_benchmark/audio/RGCoHMbgLYzYj5wTHa3eB9.wav,i want to recharge my mobile number,mobile_recharge_prepaid,[]
https://classlm.blob.core.windows.net/backend-logs/mREwJ9WGaHsDexFaAm9KnG.wav,unknown,['mobile_number-8106599529'],../data/en/npci_pipeline_benchmark/audio/mREwJ9WGaHsDexFaAm9KnG.wav,eight one zero six five double nine five two nine,gas_payment,['mobile_number-8106599529']
https://classlm.blob.core.windows.net/backend-logs/JhSoPvpwSkVJx7QG44GPDz.wav,mobile_recharge_prepaid,[],../data/en/npci_pipeline_benchmark/audio/JhSoPvpwSkVJx7QG44GPDz.wav,i want to instart my mobile number,mobile_recharge_prepaid,[]
https://classlm.blob.core.windows.net/backend-logs/C2W6JjJpXKWQykjjhnfmqw.wav,unknown,['amount_of_money-179'],../data/en/npci_pipeline_benchmark/audio/C2W6JjJpXKWQykjjhnfmqw.wav,one hundred seventy nine rupees,p2p_transfer,['amount_of_money-179']
https://classlm.blob.core.windows.net/backend-logs/bb7XHwdhcHYYBfGwxPtHbk.wav,unknown,['amount_of_money-179'],../data/en/npci_pipeline_benchmark/audio/bb7XHwdhcHYYBfGwxPtHbk.wav,one hundred seventy nine rupees,p2p_transfer,['amount_of_money-179']
https://classlm.blob.core.windows.net/backend-logs/Npotch4kgVUPBZCNmUy552.wav,mobile_recharge_prepaid,"['amount_of_money-179', 'mobile_number-8106599529']",../data/en/npci_pipeline_benchmark/audio/Npotch4kgVUPBZCNmUy552.wav,i want to recharge airtel mobile number eight one zero six five nine nine five two nine bit one hundred seventy nine rupees,mobile_recharge_prepaid,"['mobile_number-8106599529', 'amount_of_money-179']"
https://classlm.blob.core.windows.net/backend-logs/9pZGU3yTRTgbxFNXtN9tRM.wav,mobile_recharge_prepaid,['amount_of_money-10'],../data/en/npci_pipeline_benchmark/audio/9pZGU3yTRTgbxFNXtN9tRM.wav,i want to recharge my phone with ten rupees,mobile_recharge_prepaid,['amount_of_money-10']
https://classlm.blob.core.windows.net/backend-logs/ggy5cPYfmqg9EcFGc2JA4k.wav,mobile_recharge_prepaid,"['amount_of_money-10', 'mobile_number-8106599529']",../data/en/npci_pipeline_benchmark/audio/ggy5cPYfmqg9EcFGc2JA4k.wav,i want to recharge eight one zero six five nine nine five two nine mobile number with ten rupees,mobile_recharge_prepaid,"['mobile_number-8106599529', 'amount_of_money-10']"
https://classlm.blob.core.windows.net/backend-logs/YSoNoL2asVinDV4JtqeRoc.wav,mobile_recharge_prepaid,"['amount_of_money-10', 'mobile_number-8106599529']",../data/en/npci_pipeline_benchmark/audio/YSoNoL2asVinDV4JtqeRoc.wav,i want to recharge eight one zero six five nine nine five two nine mobile number with ten rupees,mobile_recharge_prepaid,"['mobile_number-8106599529', 'amount_of_money-10']"
https://classlm.blob.core.windows.net/backend-logs/HJiAXBcWptTu2DdaXej25u.wav,p2p_transfer,['amount_of_money-1'],../data/en/npci_pipeline_benchmark/audio/HJiAXBcWptTu2DdaXej25u.wav,i want to transfer one rupee to nadeem sheikh,p2p_transfer,['amount_of_money-1']
https://classlm.blob.core.windows.net/backend-logs/MgqY9QtuAmCFJuAinTtFy4.wav,mobile_recharge_prepaid,"['amount_of_money-179', 'mobile_number-8106599529']",../data/en/npci_pipeline_benchmark/audio/MgqY9QtuAmCFJuAinTtFy4.wav,i want to recharge eight one zero six five nine nine five two nine mobile number with one hundred seventy nine rupees,mobile_recharge_prepaid,"['mobile_number-8106599529', 'amount_of_money-179']"
https://classlm.blob.core.windows.net/backend-logs/SMTVo8xHGho2WB8CA4dhk4.wav,mobile_recharge_prepaid,"['amount_of_money-179', 'mobile_number-8106599529']",../data/en/npci_pipeline_benchmark/audio/SMTVo8xHGho2WB8CA4dhk4.wav,if want to recharge eight one zero six five nine nine five two nine mobile number with one hundred seventy nine rupees,mobile_recharge_prepaid,"['mobile_number-8106599529', 'amount_of_money-179']"
https://classlm.blob.core.windows.net/backend-logs/URMPGoZKQ3DSWieHEBEkwK.wav,mobile_recharge_prepaid,['mobile_number-8309658369'],../data/en/npci_pipeline_benchmark/audio/URMPGoZKQ3DSWieHEBEkwK.wav,i want to recharge jio mobile number eight three thoan nine six five eight three sixty nine with,mobile_recharge_prepaid,[]
https://classlm.blob.core.windows.net/backend-logs/jHbFVAkotjgPHqeqhgx6AC.wav,p2p_transfer,"['amount_of_money-1', 'mobile_number-8898370236']",../data/en/npci_pipeline_benchmark/audio/jHbFVAkotjgPHqeqhgx6AC.wav,please transfer one rupees to the eight eight nine eight three seven zero two three six,p2p_transfer,"['mobile_number-8898370236', 'amount_of_money-1']"
https://classlm.blob.core.windows.net/backend-logs/NyCyUYUa3H7hKsoz9Y35Sc.wav,mobile_recharge_prepaid,"['amount_of_money-199', 'mobile_number-8106599529']",../data/en/npci_pipeline_benchmark/audio/NyCyUYUa3H7hKsoz9Y35Sc.wav,i want to recharge gio mobile number eight one zero six five nine nine five two nine with one hundred ninety nine rupees,mobile_recharge_prepaid,"['mobile_number-8106599529', 'amount_of_money-199']"
https://classlm.blob.core.windows.net/backend-logs/eDuhxCyZDFsNNhAewERPig.wav,unknown,['bank_name-standard chartered bank'],../data/en/npci_pipeline_benchmark/audio/eDuhxCyZDFsNNhAewERPig.wav,standard area,balance_check,[]
https://classlm.blob.core.windows.net/backend-logs/TcaSrjx9z2rTUyhUBjAcAi.wav,unknown,['bank_name-standard chartered bank'],../data/en/npci_pipeline_benchmark/audio/TcaSrjx9z2rTUyhUBjAcAi.wav,a standard chartered bank,inform,['bank_name-Standard Chartered Bank']
https://classlm.blob.core.windows.net/backend-logs/PLenNLreDWoGkjvQbhfTea.wav,mobile_recharge_prepaid,"['amount_of_money-199', 'mobile_number-8309658369']",../data/en/npci_pipeline_benchmark/audio/PLenNLreDWoGkjvQbhfTea.wav,i want to recharge jio mobile number e three zero nine six five eight three six nine bat one hundred ninety nine rupees,mobile_recharge_prepaid,['amount_of_money-199']
https://classlm.blob.core.windows.net/backend-logs/kZisrLMpyDqnuDtSYGXHWr.wav,gas_payment,['mobile_number-7893892557'],../data/en/npci_pipeline_benchmark/audio/kZisrLMpyDqnuDtSYGXHWr.wav,i want to refill gas for mobile number seven eight nine three eight nine two double five seven,gas_payment,['mobile_number-7893892557']
https://classlm.blob.core.windows.net/backend-logs/Efm3gTuz8Lf8Ft7RTA462f.wav,gas_payment,['lpg_gas_provider_name-bharat petroleum corporation ltd.'],../data/en/npci_pipeline_benchmark/audio/Efm3gTuz8Lf8Ft7RTA462f.wav,bharat gas,gas_payment,[]
https://classlm.blob.core.windows.net/backend-logs/Jph3gm3BWJeSWDHq49hhT8.wav,gas_payment,['lpg_gas_provider_name-bharat petroleum corporation ltd.'],../data/en/npci_pipeline_benchmark/audio/Jph3gm3BWJeSWDHq49hhT8.wav,bharat gas,gas_payment,[]
https://classlm.blob.core.windows.net/backend-logs/R8BpyBL4HMV6bdQTp45Sju.wav,gas_payment,['lpg_gas_provider_name-bharat petroleum corporation ltd.'],../data/en/npci_pipeline_benchmark/audio/R8BpyBL4HMV6bdQTp45Sju.wav,bharat gas,gas_payment,[]
https://classlm.blob.core.windows.net/backend-logs/bmYPx7XLawcvJoQ9FmRVWy.wav,gas_payment,['mobile_number-9441362937'],../data/en/npci_pipeline_benchmark/audio/bmYPx7XLawcvJoQ9FmRVWy.wav,i want to retail gas first nine double four one three six two nine three seven mobile number,gas_payment,['mobile_number-9441362937']
https://classlm.blob.core.windows.net/backend-logs/iXgxo6EuRGuvRqttYkNfKz.wav,gas_payment,['mobile_number-9441362937'],../data/en/npci_pipeline_benchmark/audio/iXgxo6EuRGuvRqttYkNfKz.wav,i want to refill gas for mobile number nine four four one three six two nine three seven,gas_payment,['mobile_number-9441362937']
https://classlm.blob.core.windows.net/backend-logs/HJKHYEvPY4kvoLnRQMXq7m.wav,unknown,['lpg_gas_provider_name-indian oil corporation ltd'],../data/en/npci_pipeline_benchmark/audio/HJKHYEvPY4kvoLnRQMXq7m.wav,indian gas,gas_payment,[]
https://classlm.blob.core.windows.net/backend-logs/WeXzfHVhgWcsUWksk9WkHt.wav,unknown,['lpg_gas_provider_name-bharat petroleum corporation ltd.'],../data/en/npci_pipeline_benchmark/audio/WeXzfHVhgWcsUWksk9WkHt.wav,bharat gas,gas_payment,[]
https://classlm.blob.core.windows.net/backend-logs/YDwnfzqH4nJHKujqx9MFdV.wav,gas_payment,['lpg_gas_provider_name-indian oil corporation ltd'],../data/en/npci_pipeline_benchmark/audio/YDwnfzqH4nJHKujqx9MFdV.wav,i want to refill in dane gas,gas_payment,[]
https://classlm.blob.core.windows.net/backend-logs/m9W5RzRNwnwWJwGFq7MtiV.wav,unknown,['mobile_number-9441362937'],../data/en/npci_pipeline_benchmark/audio/m9W5RzRNwnwWJwGFq7MtiV.wav,nine four four one three six two nine three seven,mobile_recharge_prepaid,['mobile_number-9441362937']
https://classlm.blob.core.windows.net/backend-logs/ZBtNKDSrye9cLxv8xJBqYD.wav,unknown,['lpg_gas_provider_name-indian oil corporation ltd'],../data/en/npci_pipeline_benchmark/audio/ZBtNKDSrye9cLxv8xJBqYD.wav,endan gas,gas_payment,[]
https://classlm.blob.core.windows.net/backend-logs/K8prxEig2xNDFwN2y62j9n.wav,gas_payment,"['lpg_gas_provider_name-bharat petroleum corporation ltd.', 'mobile_number-7893892557']",../data/en/npci_pipeline_benchmark/audio/K8prxEig2xNDFwN2y62j9n.wav,i want to book bharat gas for mobile number seven eight nine three eight nine two double five seven,gas_payment,['mobile_number-7893892557']
https://classlm.blob.core.windows.net/backend-logs/nRxpVHrKVpatfcHW46LkLj.wav,gas_payment,['mobile_number-9441362937'],../data/en/npci_pipeline_benchmark/audio/nRxpVHrKVpatfcHW46LkLj.wav,i want to book gas first nine four four one three six two nine three seven,gas_payment,['mobile_number-9441362937']
https://classlm.blob.core.windows.net/backend-logs/DMVgG3g3KALj2Jv3yN54TS.wav,gas_payment,['mobile_number-9441362937'],../data/en/npci_pipeline_benchmark/audio/DMVgG3g3KALj2Jv3yN54TS.wav,i want to refill gas per mobile number nine four four one three six two nine three seven,gas_payment,['mobile_number-9441362937']
https://classlm.blob.core.windows.net/backend-logs/H6Awg5XShGbUAyZj47ycf5.wav,mobile_recharge_prepaid,['mobile_number-8309658369'],../data/en/npci_pipeline_benchmark/audio/H6Awg5XShGbUAyZj47ycf5.wav,i want to recharge eight three zero nine six five eight three six nine with ten rupees,mobile_recharge_prepaid,"['mobile_number-8309658369', 'amount_of_money-10']"
https://classlm.blob.core.windows.net/backend-logs/HxX7mGFuXA3CotwJcvdJ6H.wav,mobile_recharge_prepaid,"['amount_of_money-199', 'mobile_number-8309658369']",../data/en/npci_pipeline_benchmark/audio/HxX7mGFuXA3CotwJcvdJ6H.wav,i want to reach eight three zero nine six five eight three six nine mobile number with one hundred ninety nine rupees,mobile_recharge_prepaid,"['mobile_number-8309658369', 'amount_of_money-199']"
https://classlm.blob.core.windows.net/backend-logs/nd9N4QkLDyGf2XvnG9vtwZ.wav,mobile_recharge_prepaid,"['amount_of_money-179', 'mobile_number-830658369']",../data/en/npci_pipeline_benchmark/audio/nd9N4QkLDyGf2XvnG9vtwZ.wav,i want to recharge eight three zero nine six five eight sree six nine mobile number with one hundred seventy nine rupees,mobile_recharge_prepaid,['amount_of_money-179']
https://classlm.blob.core.windows.net/backend-logs/REm2cK3Q5gSqqs4k8sv92S.wav,mobile_recharge_prepaid,"['amount_of_money-199', 'mobile_number-8309658369']",../data/en/npci_pipeline_benchmark/audio/REm2cK3Q5gSqqs4k8sv92S.wav,i want to recharge eight three zero nine six five eight three six nine bits one hundred ninety nine rupees,mobile_recharge_prepaid,"['mobile_number-8309658369', 'amount_of_money-199']"
https://classlm.blob.core.windows.net/backend-logs/6xcQDeE3aaSh3tWuPuYHma.wav,mobile_recharge_prepaid,"['amount_of_money-199', 'mobile_number-8309658369']",../data/en/npci_pipeline_benchmark/audio/6xcQDeE3aaSh3tWuPuYHma.wav,i want to recharge eight three zero nine six five eight three six nine peoples one hundred ninety nine rupees,mobile_recharge_prepaid,"['mobile_number-8309658369', 'amount_of_money-199']"
https://classlm.blob.core.windows.net/backend-logs/knQ5AGtWMkWyLqT63EHzQG.wav,mobile_recharge_prepaid,['mobile_number-8309658369'],../data/en/npci_pipeline_benchmark/audio/knQ5AGtWMkWyLqT63EHzQG.wav,i want to recharge eight three thane six by eight three with my mobile number with one hundred ninety nine degres,mobile_recharge_prepaid,[]
https://classlm.blob.core.windows.net/backend-logs/QgeV4othAbtoPSCSQfbTbX.wav,mobile_recharge_prepaid,['amount_of_money-199'],../data/en/npci_pipeline_benchmark/audio/QgeV4othAbtoPSCSQfbTbX.wav,mobile number mobile i want to recharge my mobile number with one hundred ninety nine rupees,mobile_recharge_prepaid,['amount_of_money-199']
https://classlm.blob.core.windows.net/backend-logs/Jfj6CGK3Rg8iNwwATGmkts.wav,p2p_transfer,['amount_of_money-1'],../data/en/npci_pipeline_benchmark/audio/Jfj6CGK3Rg8iNwwATGmkts.wav,i want to transfer money to ront happy home the amountis rupees one,p2p_transfer,['amount_of_money-1']
https://classlm.blob.core.windows.net/backend-logs/QbyooPrMMTCvh9q9YcB8zQ.wav,mobile_recharge_prepaid,"['amount_of_money-199', 'mobile_number-8296551041']",../data/en/npci_pipeline_benchmark/audio/QbyooPrMMTCvh9q9YcB8zQ.wav,i want to recharge my number eight two nine six double five one zero four one four with one hundred ninety nine rupees,mobile_recharge_prepaid,"['mobile_number-8296551041', 'amount_of_money-199']"
https://classlm.blob.core.windows.net/backend-logs/A4RWLER47YtNjS6vdj5vVg.wav,p2p_transfer,"['amount_of_money-10', 'mobile_number-9820438332']",../data/en/npci_pipeline_benchmark/audio/A4RWLER47YtNjS6vdj5vVg.wav,i want to transfer rupees ten to mobile number nine eight two zero four three eight three three,p2p_transfer,['amount_of_money-10']
https://classlm.blob.core.windows.net/backend-logs/fcxH7w2cNa89KKoHWyeuni.wav,unknown,['bank_name-axis bank'],../data/en/npci_pipeline_benchmark/audio/fcxH7w2cNa89KKoHWyeuni.wav,access bank account access axis is,inform,['bank_name-Axis Bank']
https://classlm.blob.core.windows.net/backend-logs/LWGH3N8fxPnFATTHz7294s.wav,electricity_payment,[],../data/en/npci_pipeline_benchmark/audio/LWGH3N8fxPnFATTHz7294s.wav,i want to pay electricity bill,electricity_payment,[]
https://classlm.blob.core.windows.net/backend-logs/fpjFNSCrGurWwmH8S7QRYs.wav,electricity_payment,['electricity_board-tamil nadu electricity board (tneb)'],../data/en/npci_pipeline_benchmark/audio/fpjFNSCrGurWwmH8S7QRYs.wav,i want to pay electricity bill for tamil nadu electricity board,electricity_payment,[]
https://classlm.blob.core.windows.net/backend-logs/Dm7uKUsGYFwMvzaymksvGi.wav,electricity_payment,['electricity_board-bangalore electricity supply co. ltd (bescom)'],../data/en/npci_pipeline_benchmark/audio/Dm7uKUsGYFwMvzaymksvGi.wav,i want to pay electricity bill for bangalore electricity supply company limited,electricity_payment,[]
https://classlm.blob.core.windows.net/backend-logs/QfKp8RtrKT53rYNGUmYMgG.wav,electricity_payment,['electricity_board-bangalore electricity supply co. ltd (bescom)'],../data/en/npci_pipeline_benchmark/audio/QfKp8RtrKT53rYNGUmYMgG.wav,i want to pay electricity bill for bangalore electricity supply corporation li mited,electricity_payment,[]
https://classlm.blob.core.windows.net/backend-logs/7tBkcwaa9q66f3upM6TBsR.wav,electricity_payment,['electricity_board-bangalore electricity supply co. ltd (bescom)'],../data/en/npci_pipeline_benchmark/audio/7tBkcwaa9q66f3upM6TBsR.wav,id i want to pay electricity bill for bangalore electricity supply corporation li mited,electricity_payment,[]
https://classlm.blob.core.windows.net/backend-logs/eV6KabQVE4T3BUPiJCWQjg.wav,balance_check,[],../data/en/npci_pipeline_benchmark/audio/eV6KabQVE4T3BUPiJCWQjg.wav,i want to check balance,balance_check,[]
https://classlm.blob.core.windows.net/backend-logs/3Z94o4iSSkXPQLyxwgMVrr.wav,p2p_transfer,"['amount_of_money-1', 'bank_name-standard chartered bank', 'mobile_number-7506610116']",../data/en/npci_pipeline_benchmark/audio/3Z94o4iSSkXPQLyxwgMVrr.wav,i want to transfer one rupees to mobile number seven five zero six six one zero one one six from standard chartered bank,p2p_transfer,"['bank_name-Standard Chartered Bank', 'mobile_number-7506610116', 'amount_of_money-1']"
https://classlm.blob.core.windows.net/backend-logs/dt9HTs46BmR6Hf2Jm7qrmV.wav,unknown,['bank_name-axis bank'],../data/en/npci_pipeline_benchmark/audio/dt9HTs46BmR6Hf2Jm7qrmV.wav,access bank,inform,['bank_name-Axis Bank']
https://classlm.blob.core.windows.net/backend-logs/VroCWdyPE9AP9TghCteKHc.wav,unknown,['bank_name-axis bank'],../data/en/npci_pipeline_benchmark/audio/VroCWdyPE9AP9TghCteKHc.wav,access bank,inform,['bank_name-Axis Bank']
https://classlm.blob.core.windows.net/backend-logs/fvwCEeVLvnkY8CiUBuaJQH.wav,p2p_transfer,[],../data/en/npci_pipeline_benchmark/audio/fvwCEeVLvnkY8CiUBuaJQH.wav,i want to transfer money,p2p_transfer,[]
https://classlm.blob.core.windows.net/backend-logs/EhBJkXAsnZ5LBKPzUWvuHw.wav,unknown,['bank_name-bank of baroda'],../data/en/npci_pipeline_benchmark/audio/EhBJkXAsnZ5LBKPzUWvuHw.wav,bank of baroda,inform,['bank_name-Bank of Baroda']
https://classlm.blob.core.windows.net/backend-logs/KeTvCK83gpnxvxJjFD8mdz.wav,unknown,['mobile_number-9666994241'],../data/en/npci_pipeline_benchmark/audio/KeTvCK83gpnxvxJjFD8mdz.wav,nine triple six double nine four two four one,electricity_payment,['mobile_number-9666994241']
https://classlm.blob.core.windows.net/backend-logs/65tLcCMuB3mfLRWk2RNFk7.wav,unknown,['mobile_number-9666994241'],../data/en/npci_pipeline_benchmark/audio/65tLcCMuB3mfLRWk2RNFk7.wav,nine triple six double nine four two four one,electricity_payment,['mobile_number-9666994241']
https://classlm.blob.core.windows.net/backend-logs/Sn36exRoPknSTDNPWLYYmi.wav,mobile_recharge_prepaid,[],../data/en/npci_pipeline_benchmark/audio/Sn36exRoPknSTDNPWLYYmi.wav,i want to do mobile recharge,mobile_recharge_prepaid,[]
https://classlm.blob.core.windows.net/backend-logs/HqVDtcBauYEyWu7irbmj9K.wav,unknown,['mobile_number-8309658369'],../data/en/npci_pipeline_benchmark/audio/HqVDtcBauYEyWu7irbmj9K.wav,eight three zero nine six by eight three six nine,electricity_payment,[]
https://classlm.blob.core.windows.net/backend-logs/AZAkoGtHerPGm8ua9WkZhd.wav,unknown,['mobile_number-8309658369'],../data/en/npci_pipeline_benchmark/audio/AZAkoGtHerPGm8ua9WkZhd.wav,eight three zero nine six five eight three six nine,upi_creation,['mobile_number-8309658369']
https://classlm.blob.core.windows.net/backend-logs/6rpRRuAHhZGCpRHc2eCM58.wav,unknown,['amount_of_money-199'],../data/en/npci_pipeline_benchmark/audio/6rpRRuAHhZGCpRHc2eCM58.wav,one hundred ninety nine rupees,p2p_transfer,['amount_of_money-199']
https://classlm.blob.core.windows.net/backend-logs/VHgRRyeMsxDc8KiZWngbuP.wav,unknown,['bank_name-bank of baroda'],../data/en/npci_pipeline_benchmark/audio/VHgRRyeMsxDc8KiZWngbuP.wav,bank of baroda,inform,['bank_name-Bank of Baroda']
https://classlm.blob.core.windows.net/backend-logs/h8LyQs6mMt6GzxArsHUFn2.wav,gas_payment,[],../data/en/npci_pipeline_benchmark/audio/h8LyQs6mMt6GzxArsHUFn2.wav,i want to refill gas,gas_payment,[]
https://classlm.blob.core.windows.net/backend-logs/kFftAz7CL5uxD5HQoZX3ys.wav,gas_payment,[],../data/en/npci_pipeline_benchmark/audio/kFftAz7CL5uxD5HQoZX3ys.wav,i want to refill gas,gas_payment,[]
https://classlm.blob.core.windows.net/backend-logs/QWMpsYXfgPCr8npjZhA3j6.wav,unknown,['mobile_number-7893892557'],../data/en/npci_pipeline_benchmark/audio/QWMpsYXfgPCr8npjZhA3j6.wav,seven eight nine three eight nine do double by seven,mobile_recharge_prepaid,[]
https://classlm.blob.core.windows.net/backend-logs/h4ucKvKqGuGZosUvRynqHg.wav,unknown,['lpg_gas_provider_name-bharat petroleum corporation ltd.'],../data/en/npci_pipeline_benchmark/audio/h4ucKvKqGuGZosUvRynqHg.wav,bharat gas,gas_payment,[]
https://classlm.blob.core.windows.net/backend-logs/EbaAoSWRZXnmezLnacfsCX.wav,unknown,['lpg_gas_provider_name-bharat petroleum corporation ltd.'],../data/en/npci_pipeline_benchmark/audio/EbaAoSWRZXnmezLnacfsCX.wav,bharat gas,gas_payment,[]
https://classlm.blob.core.windows.net/backend-logs/QCHH8AFfMHBmkfsmzmAPr9.wav,unknown,['lpg_gas_provider_name-bharat petroleum corporation ltd.'],../data/en/npci_pipeline_benchmark/audio/QCHH8AFfMHBmkfsmzmAPr9.wav,bharat gas,gas_payment,[]
https://classlm.blob.core.windows.net/backend-logs/8ZVXEXziZtZPqNszkoj7C6.wav,unknown,['lpg_gas_provider_name-bharat petroleum corporation ltd.'],../data/en/npci_pipeline_benchmark/audio/8ZVXEXziZtZPqNszkoj7C6.wav,bharat gas,gas_payment,[]
https://classlm.blob.core.windows.net/backend-logs/A24kcfGRBjQggLM39Cu4nR.wav,gas_payment,[],../data/en/npci_pipeline_benchmark/audio/A24kcfGRBjQggLM39Cu4nR.wav,i want to refill gas,gas_payment,[]
https://classlm.blob.core.windows.net/backend-logs/AKJ4vAaPbNcGc2NUBVdWPf.wav,balance_check,[],../data/en/npci_pipeline_benchmark/audio/AKJ4vAaPbNcGc2NUBVdWPf.wav,i want to check my balance,balance_check,[]
https://classlm.blob.core.windows.net/backend-logs/STeJ8uAK6xPkeFABbZJQG4.wav,unknown,['bank_name-bank of baroda'],../data/en/npci_pipeline_benchmark/audio/STeJ8uAK6xPkeFABbZJQG4.wav,bank of baroda,inform,['bank_name-Bank of Baroda']
https://classlm.blob.core.windows.net/backend-logs/PuAwmMWUN8dy5rFMpVf78A.wav,unknown,['bank_name-bank of baroda'],../data/en/npci_pipeline_benchmark/audio/PuAwmMWUN8dy5rFMpVf78A.wav,bank of baroda,inform,['bank_name-Bank of Baroda']
https://classlm.blob.core.windows.net/backend-logs/5tSvtU3QXk3rAo3vCUyCn6.wav,unknown,['bank_name-axis bank'],../data/en/npci_pipeline_benchmark/audio/5tSvtU3QXk3rAo3vCUyCn6.wav,access bank,inform,['bank_name-Axis Bank']
https://classlm.blob.core.windows.net/backend-logs/LTVvxwyyq5ojfVchdjMKSr.wav,unknown,['bank_name-axis bank'],../data/en/npci_pipeline_benchmark/audio/LTVvxwyyq5ojfVchdjMKSr.wav,ax is bank,inform,['bank_name-Axis Bank']
https://classlm.blob.core.windows.net/backend-logs/ALE6WJEBLo9gsmVPMjCST8.wav,electricity_payment,[],../data/en/npci_pipeline_benchmark/audio/ALE6WJEBLo9gsmVPMjCST8.wav,i want to play electricity,electricity_payment,[]
https://classlm.blob.core.windows.net/backend-logs/LRHbA2gxYDzS8FTGbZUF7v.wav,electricity_payment,[],../data/en/npci_pipeline_benchmark/audio/LRHbA2gxYDzS8FTGbZUF7v.wav,i want to pay electricity bill,electricity_payment,[]
https://classlm.blob.core.windows.net/backend-logs/9n5U3vNQSumvypH3xzPMJn.wav,unknown,['bank_name-axis bank'],../data/en/npci_pipeline_benchmark/audio/9n5U3vNQSumvypH3xzPMJn.wav,axis bank,inform,['bank_name-Axis Bank']
https://classlm.blob.core.windows.net/backend-logs/ZxZojShy55zMWoFWPtZzC7.wav,electricity_payment,[],../data/en/npci_pipeline_benchmark/audio/ZxZojShy55zMWoFWPtZzC7.wav,i want to pay electricity bill,electricity_payment,[]
https://classlm.blob.core.windows.net/backend-logs/HTzCPpxdUYc9ezZLgqAr2Z.wav,unknown,['bank_name-axis bank'],../data/en/npci_pipeline_benchmark/audio/HTzCPpxdUYc9ezZLgqAr2Z.wav,access bank,inform,['bank_name-Axis Bank']
https://classlm.blob.core.windows.net/backend-logs/i6JTDHRz6S4JVMJKdATVD8.wav,unknown,['bank_name-axis bank'],../data/en/npci_pipeline_benchmark/audio/i6JTDHRz6S4JVMJKdATVD8.wav,active bank,balance_check,[]
https://classlm.blob.core.windows.net/backend-logs/h4Vv9jSt4Qc7YYRozAzss4.wav,electricity_payment,[],../data/en/npci_pipeline_benchmark/audio/h4Vv9jSt4Qc7YYRozAzss4.wav,i want to play cricket id,inform,[]
https://classlm.blob.core.windows.net/backend-logs/U9xnut978PS5T3bEH5ma8f.wav,electricity_payment,[],../data/en/npci_pipeline_benchmark/audio/U9xnut978PS5T3bEH5ma8f.wav,id i wanted to pay electricity id top top,electricity_payment,[]
https://classlm.blob.core.windows.net/backend-logs/3YHoispjvHTytDqhHENYKf.wav,electricity_payment,[],../data/en/npci_pipeline_benchmark/audio/3YHoispjvHTytDqhHENYKf.wav,come on to pay electricity id,electricity_payment,[]
https://classlm.blob.core.windows.net/backend-logs/oFysVHxiZLXymhiK9RBoX3.wav,unknown,['bank_name-uco bank'],../data/en/npci_pipeline_benchmark/audio/oFysVHxiZLXymhiK9RBoX3.wav,my accountis in up uk bank,upi_creation,[]
https://classlm.blob.core.windows.net/backend-logs/HJhCZRKgTYg6xBrGLnzUrF.wav,unknown,['lpg_gas_provider_name-bharat petroleum corporation ltd.'],../data/en/npci_pipeline_benchmark/audio/HJhCZRKgTYg6xBrGLnzUrF.wav,sree i want to pay bharat tras,fastag_recharge,[]
https://classlm.blob.core.windows.net/backend-logs/6siiwvyM8SthFpPmapyaPp.wav,unknown,['bank_name-bank of india'],../data/en/npci_pipeline_benchmark/audio/6siiwvyM8SthFpPmapyaPp.wav,my accountis in state bank of india,inform,['bank_name-State Bank of India']
https://classlm.blob.core.windows.net/backend-logs/FXFh3dPurmDq3eSSJXsgUm.wav,unknown,['amount_of_money-100'],../data/en/npci_pipeline_benchmark/audio/FXFh3dPurmDq3eSSJXsgUm.wav,signed one hundred rupees,p2p_transfer,['amount_of_money-100']
https://classlm.blob.core.windows.net/backend-logs/gUffyDYCzLt4mVkQR8ernS.wav,unknown,['amount_of_money-100'],../data/en/npci_pipeline_benchmark/audio/gUffyDYCzLt4mVkQR8ernS.wav,send one hundred rupees,p2p_transfer,['amount_of_money-100']
https://classlm.blob.core.windows.net/backend-logs/WFjQwBz843WzibvKByKkBf.wav,gas_payment,['lpg_gas_provider_name-bharat petroleum corporation ltd.'],../data/en/npci_pipeline_benchmark/audio/WFjQwBz843WzibvKByKkBf.wav,i want to do refill bharat gas,gas_payment,[]
